{
  "$schema": "./../schema.json",
  "name": "Stofa - en del af Norlys",
  "url": "https://stofa.dk",
  "ipv6": true,
  "comment": "Erhvervskunder og privatkunder på fiber har mulighed for IPv6, en del forbrugere aktiveret pr. default. IPv6 på COAX forbindelser understøttes ikke af TDC. xDSL (kobber) ukendt",
  "partial": true,
  "sources": [
    {
      "date": "2022-08-18",
      "name": "ISP",
      "url": null
    },
    {
      "date": "2021-12-10",
      "name": "ISP",
      "url": null
    }
  ]
}
