{
  "name": "Fastspeed (og JETNET)",
  "url": "https://fastspeed.dk",
  "ipv6": true,
  "comment": "Faspeed understøtter IPv6 (undtaget Aura's fibernet). IPv6 på COAX forbindelser understøttes ikke af TDC.",
  "partial": true,
  "private": true,
  "sources": [{ "date": "2020-04-28", "name": "ISP", "url": null }]
}
