{
  "name": "KAZOOM",
  "url": "https://www.kazoom.dk",
  "ipv6": false,
  "comment": "IPv6 adresser er ikke noget, KAZOOM har mulighed for at tildele",
  "partial": false,
  "sources": [
    {
      "date": "2020-12-30",
      "name": "ISP",
      "url": "https://www.kazoom.dk/sporgsmal-og-svar-opsaetning-og-installation/kan-jeg-fa-en-fast-ip-adresse"
    }
  ]
}
