{
  "$schema": "./../schema.json",
  "name": "Dansk Kabel TV",
  "url": "https://www.danskkabeltv.dk",
  "ipv6": false,
  "comment": "De kan på nuværende tidspunkt, ikke oplyse om de kommer til at tilbyde IPv6, på et senere tidspunkt.",
  "partial": false,
  "sources": [{ "date": "2023-04-20", "name": "ISP", "url": null }]
}
