{
  "name": "Zen Systems (ejet af GlobalConnect)",
  "url": "https://www.globalconnect.dk",
  "ipv6": true,
  "comment": "Vi er fuldt IPv6 klar og har allerede nogle kunder som k√∏rer dual stack. Leverer kun til erhvervskunder.",
  "partial": false,
  "business": true,
  "sources": [{ "date": "2013-09-30", "name": "ISP", "url": null }]
}
