{
  "$schema": "./../schema.json",
  "name": "Parknet",
  "url": "https://parknet.dk",
  "ipv6": false,
  "comment": "Det er noget vi arbejder hen imod. Jeg har dog ingen dato for hvorn√•r det vil blive rullet ud.",
  "partial": false,
  "sources": [{ "date": "2023-06-09", "name": "ISP (Email)", "url": null }]
}
