{
  "name": "Boxer",
  "url": "https://www.boxertv.dk",
  "ipv6": false,
  "comment": "For nu har TDC rigeligt IP-adresser. Såfremt TDC Privat beslutter at indføre IPv6, så kommer Boxer Bredbånd også til at få det.",
  "partial": false,
  "private": true,
  "sources": [{ "date": "2016-01-25", "name": "ISP", "url": null }]
}
