{
  "$schema": "./../schema.json",
  "name": "Telia",
  "url": "https://www.telia.dk/privat/",
  "ipv6": true,
  "comment": "Leverer IPv6. Ikke alle routere er underst√∏ttet.",
  "partial": true,
  "sources": [
    {
      "date": "2015-03-11",
      "name": "Tweet",
      "url": "https://twitter.com/TeliaDanmark/status/626304483937624064"
    }
  ]
}
