{"name":"Hiper","url":"https://www.hiper.dk","ipv6":true,"comment":"Vil tildeler IPv6 til alle kunder på både xDSL og fiber. Vi håber også at kunne komme til at gøre det på coax inden for overskuelig fremtid, men det er vi desværre ikke selv herre over grundet platformens indretning.","partial":true,"private":true,"sources":[{"date":"2015-12-16","name":"ISP","url":null}]}