{
  "name": "TDC Erhverv",
  "url": "https://tdc.dk",
  "ipv6": true,
  "comment": "Leverer IPv6 til erhverv på professionelle fiberløsninger.",
  "partial": true,
  "business": true,
  "sources": [
    {
      "date": "2016-04-06",
      "name": "Tweet",
      "url": "https://twitter.com/ikjensen/status/575569892990193664"
    }
  ]
}
