{
  "$schema": "./../schema.json",
  "name": "Kalundborgegnens Antennelaug",
  "url": "https://ka-net.dk/",
  "ipv6": true,
  "comment": "Kalundborgegnens Antennelaug k√∏rer IPv6 Dual stack helt ud til slutbrugeren.",
  "partial": false,
  "private": true,
  "sources": [{ "date": "2017-06-06", "name": "ISP", "url": null }]
}
