{
  "$schema": "./../schema.json",
  "name": "ASOM-Net",
  "url": "https://asom-net.dk",
  "ipv6": true,
  "comment": "ASOM-Net tilbyder dual-stack IPv6 med /48 prefix-delegation hos alle kunder. Leverer kun til private.",
  "partial": false,
  "private": true,
  "sources": [{ "date": "2022-09-09", "name": "ISP", "url": null }]
}
