{
  "$schema": "./../schema.json",
  "name": "Altibox",
  "url": "https://www.altibox.dk",
  "ipv6": false,
  "comment": "Vi tilbyder ikke på nuværende tidspunkt statisk tildeling af IPv6 prefix/adresser.",
  "partial": true,
  "sources": [{ "date": "2023-11-06", "name": "ISP (Email)", "url": null }]
}
