{
  "$schema": "./../schema.json",
  "name": "Kviknet",
  "url": "https://www.kviknet.dk",
  "ipv6": true,
  "comment": "Kviknet understøtter IPv6. IPv6 på COAX forbindelser understøttes ikke af TDC.",
  "partial": true,
  "private": true,
  "sources": [
    {
      "date": "2023-12-22",
      "name": "Kviknet FAQ - Internet Optsætning",
      "url": "https://web.archive.org/web/20221003090412/https://support.kviknet.dk/hc/da/articles/6495304559249-Internet-ops%C3%A6tning"
    },
    {
      "date": "2023-12-22",
      "name": "Kviknet FAQ - DHCPv6 IAID Issues",
      "url": "https://web.archive.org/web/20220813145436/https://support.kviknet.dk/hc/da/articles/7972272930193-DHCPv6-IAID-Issues"
    },
    {
      "date": "2023-12-22",
      "name": "Kviknet FAQ - Statisk DUID Værdi",
      "url": "https://web.archive.org/web/20221003075730/https://support.kviknet.dk/hc/da/articles/6650187045265-Statisk-DUID-v%C3%A6rdi"
    },
    {
      "date": "2021-11-17",
      "name": "Email",
      "url": "https://github.com/emilstahl/ipv6/issues/48"
    },
    {
      "date": "2020-10-01",
      "name": "ISP",
      "url": "https://www.kviknet.dk/produktinfo/fiber_norlys"
    },
    {
      "date": "2016-10-28",
      "name": "ISP",
      "url": "https://v2.dk/1011318"
    }
  ]
}
