{
  "$schema": "./../schema.json",
  "name": "Telenor",
  "url": "https://www.telenor.dk",
  "ipv6": false,
  "comment": "Der er ikke specifikke planer for implementering af IPv6 i øjeblikket.",
  "partial": true,
  "sources": [
    {
      "date": "2023-04-20",
      "name": "FB Tråd",
      "url": "https://www.facebook.com/telenordanmark/posts/492241444121526"
    },
    {
      "date": "2020-05-27",
      "name": "Tweet",
      "url": "https://twitter.com/Dpj_DBB/status/1265623450166734849"
    }
  ]
}
