{"name":"Energi Fyn","url":"https://www.energifyn.dk/privat","ipv6":true,"comment":"Understøtter IPv6 i vores Erhverv Pro-produkt. Der går nok nogle år endnu før vi tilbyder til privatkunder.","partial":true,"sources":[{"date":"2016-05-27","name":"PDF","url":"https://www.energifyn.dk/-/media/energifyndk/ny-struktur/dokumenter/erhverv/fibernet/erhverv-fibernet_produktspecifikation-erhverv-pro_18-10-2017.ashx"}]}