{
  "$schema": "./../schema.json",
  "name": "Norlys",
  "url": "https://www.norlys.dk",
  "ipv6": true,
  "comment": "Erhvervskunder og privatkunder på fiber har mulighed for IPv6, en del forbrugere aktiveret pr. default. IPv6 på COAX forbindelser understøttes ikke af TDC. xDSL (kobber) ukendt",
  "partial": true,
  "private": true,
  "sources": [{ "date": "2023-09-20", "name": "ISP", "url": null }]
}
