{"name":"bolig:net","url":"https://www.bolignet.dk","ipv6":false,"comment":"Har omlagt netværk April 2021, fjernet IPv6 for en stor andel af kunderne. Forventer der vil gå måneder.","partial":false,"sources":[{"date":"2021-04-14","name":"Tweet","url":"https://twitter.com/kramse/status/1382277899684827138"}]}